{
  "$schema": "https://json-schema.org/draft/2020-12/schema",
  "$id": "https://local.paper-collage.dev/quality-report.schema.json",
  "title": "Paper Collage Asset and Composite Quality Report",
  "type": "object",
  "required": ["schemaVersion", "projectSlug", "updatedAt", "cueEvents", "assets", "composites"],
  "properties": {
    "$schema": {"type": "string"},
    "schemaVersion": {"const": 2},
    "projectSlug": {"type": "string", "pattern": "^[a-z0-9]+(?:-[a-z0-9]+)*$"},
    "updatedAt": {"type": "string", "format": "date-time"},
    "cueEvents": {"type": "array", "items": {"type": "object"}},
    "assets": {
      "type": "array",
      "items": {
        "type": "object",
        "required": ["assetId", "file", "kind", "sources", "sha256", "requiredChecks", "technical", "semanticChecks", "status", "reviewer", "reviewedAt", "note"],
        "properties": {
          "assetId": {"type": "string", "minLength": 1},
          "file": {"type": "string", "minLength": 1},
          "kind": {"enum": ["background", "environment", "character", "prop", "decorative", "character-sheet", "style-sample", "mechanism", "diagram", "image"]},
          "sources": {"type": "array", "items": {"type": "string"}},
          "sha256": {"type": ["string", "null"]},
          "fingerprint": {"type": ["string", "null"]},
          "semanticBinding": {"type": ["object", "null"]},
          "stateSheetBinding": {"type": ["object", "null"]},
          "stateSheetRecoveryBinding": {"type": ["object", "null"]},
          "recoverySourceFile": {"type": ["string", "null"]},
          "recoverySourceSha256": {"type": ["string", "null"]},
          "recoveryEvidenceFiles": {"type": "array", "items": {"type": "string"}},
          "semanticContractFingerprints": {"type": "object", "additionalProperties": {"type": ["string", "null"]}},
          "requiredChecks": {"type": "array", "items": {"type": "string"}},
          "technical": {"type": "object"},
          "semanticChecks": {"type": "object"},
          "status": {"enum": ["pending", "passed", "needs-revision"]},
          "reviewer": {"type": ["string", "null"]},
          "reviewedAt": {"type": ["string", "null"]},
          "note": {"type": "string"},
          "evidenceFiles": {"$ref": "#/$defs/evidenceFiles"}
        },
        "additionalProperties": false
      }
    },
    "composites": {
      "type": "array",
      "items": {
        "type": "object",
        "required": ["compositeId", "sceneId", "pattern", "nodeId", "memberNodeIds", "memberHashes", "compositionHash", "fingerprint", "proofTimeIds", "proofFrames", "requiredChecks", "technical", "semanticChecks", "status", "reviewer", "reviewedAt", "note"],
        "properties": {
          "compositeId": {"type": "string", "minLength": 1},
          "sceneId": {"type": "string", "minLength": 1},
          "pattern": {"enum": ["supported-subject", "registered-environment", "state-sequence", "cue", "semantic-contract"]},
          "nodeId": {"type": "string", "minLength": 1},
          "memberNodeIds": {"type": "array", "items": {"type": "string"}},
          "memberHashes": {"type": "object", "additionalProperties": {"type": ["string", "null"]}},
          "compositionHash": {"type": "string", "minLength": 1},
          "fingerprint": {"type": "string", "minLength": 1},
          "proofTimeIds": {"type": "array", "items": {"type": "string"}},
          "proofShots": {"type": "array", "items": {"type": "object"}},
          "contractId": {"type": "string"},
          "contractKind": {"enum": ["identity", "topology", "mechanism", "diagram"]},
          "proofFrames": {"type": "array", "items": {"type": "object"}},
          "requiredChecks": {"type": "array", "items": {"type": "string"}},
          "technical": {"type": "object"},
          "semanticChecks": {"type": "object"},
          "status": {"enum": ["pending", "passed", "needs-revision"]},
          "reviewer": {"type": ["string", "null"]},
          "reviewedAt": {"type": ["string", "null"]},
          "note": {"type": "string"},
          "evidenceFiles": {"$ref": "#/$defs/evidenceFiles"}
        },
        "additionalProperties": false
      }
    }
  },
  "$defs": {
    "evidenceFiles": {
      "type": "array",
      "items": {
        "type": "object",
        "required": ["file", "sha256"],
        "properties": {
          "file": {"type": "string", "minLength": 1},
          "sha256": {"type": "string", "minLength": 64, "maxLength": 64}
        },
        "additionalProperties": false
      }
    }
  },
  "additionalProperties": false
}
