{
  "$schema": "../../schemas/quality-report.schema.json",
  "schemaVersion": 2,
  "projectSlug": "last-red-leaf",
  "updatedAt": "2026-07-21T17:18:02.183Z",
  "cueEvents": [
    {
      "sceneId": "scene-01",
      "cueId": "s1-establish-autumn",
      "beatId": "s1-b1-establish-autumn",
      "targetId": "puddle-environment",
      "action": "reveal",
      "localFrame": 28,
      "absoluteFrame": 28,
      "seconds": 0.9333333333333333,
      "proofTimeId": "s1-proof-establish",
      "sound": null
    },
    {
      "sceneId": "scene-01",
      "cueId": "s1-reveal-puddle",
      "beatId": "s1-b2-reveal-puddle",
      "targetId": "ground-snail-rig",
      "action": "pulse",
      "localFrame": 112,
      "absoluteFrame": 112,
      "seconds": 3.7333333333333334,
      "proofTimeId": null,
      "sound": null
    },
    {
      "sceneId": "scene-01",
      "cueId": "s1-wind-arrives",
      "beatId": "s1-b3-wind-arrives",
      "targetId": "wind-lines-free",
      "action": "shake",
      "localFrame": 203,
      "absoluteFrame": 203,
      "seconds": 6.766666666666667,
      "proofTimeId": "s1-proof-wind-shelter",
      "sound": "projects/last-red-leaf/audio/sfx/cold-wind-gust.wav"
    },
    {
      "sceneId": "scene-01",
      "cueId": "s1-shelter-holds",
      "beatId": "s1-b4-shelter-holds",
      "targetId": "scene-01-tableau",
      "action": "settle",
      "localFrame": 294,
      "absoluteFrame": 294,
      "seconds": 9.8,
      "proofTimeId": "s1-proof-final",
      "sound": "projects/last-red-leaf/audio/sfx/leaf-rustle.wav"
    },
    {
      "sceneId": "scene-02",
      "cueId": "s2-leaf-lifts",
      "beatId": "s2-b1-leaf-lifts",
      "targetId": "leaf-boat-rig",
      "action": "lift",
      "localFrame": 35,
      "absoluteFrame": 377,
      "seconds": 12.566666666666666,
      "proofTimeId": "s2-proof-leaf-landing",
      "sound": "projects/last-red-leaf/audio/sfx/strong-wind-gust.wav"
    },
    {
      "sceneId": "scene-02",
      "cueId": "s2-leaf-lands",
      "beatId": "s2-b2-leaf-lands",
      "targetId": "leaf-boat-rig",
      "action": "settle",
      "localFrame": 133,
      "absoluteFrame": 475,
      "seconds": 15.833333333333334,
      "proofTimeId": "s2-proof-leaf-landing",
      "sound": "projects/last-red-leaf/audio/sfx/soft-leaf-splash.wav"
    },
    {
      "sceneId": "scene-02",
      "cueId": "s2-snail-boards",
      "beatId": "s2-b3-snail-boards",
      "targetId": "snail-subject",
      "action": "lift",
      "localFrame": 230,
      "absoluteFrame": 572,
      "seconds": 19.066666666666666,
      "proofTimeId": "s2-proof-snail-aboard",
      "sound": null
    },
    {
      "sceneId": "scene-02",
      "cueId": "s2-crossing",
      "beatId": "s2-b4-crossing",
      "targetId": "leaf-boat-rig",
      "action": "lift",
      "localFrame": 318,
      "absoluteFrame": 660,
      "seconds": 22,
      "proofTimeId": null,
      "sound": null
    },
    {
      "sceneId": "scene-02",
      "cueId": "s2-warm-arrival",
      "beatId": "s2-b5-warm-arrival",
      "targetId": "leaf-boat-rig",
      "action": "settle",
      "localFrame": 398,
      "absoluteFrame": 740,
      "seconds": 24.666666666666668,
      "proofTimeId": "s2-proof-final",
      "sound": null
    }
  ],
  "assets": [
    {
      "assetId": "bank-upper",
      "file": "public/projects/last-red-leaf/assets/style/bank-upper.png",
      "kind": "environment",
      "sources": [
        "scene:scene-01:node:bank-upper",
        "scene:scene-02:node:bank-upper",
        "manifest:bank-upper"
      ],
      "semanticBinding": {
        "riskClass": "topology-critical",
        "contractIds": [
          "shore-water-boundary"
        ]
      },
      "requiredChecks": [
        "no-text",
        "no-watermark",
        "subject-complete",
        "style-consistent",
        "silhouette-fidelity",
        "negative-space-clean",
        "background-leak-free",
        "edge-clean"
      ],
      "semanticContractFingerprints": {
        "shore-water-boundary": "1341676ab665534de5eae6af03493fdbddb26f19afcffb14df1f069c8c2da7e4"
      },
      "sha256": "0078d682422e47d385ff7674ee02014b92ce86c54685ca7ae2daa10392244ba3",
      "fingerprint": "5e27c185590d907fc8edae2a4ed73f96f6724d2192eaa856c7c7fa2e3c611fa5",
      "technical": {
        "passed": true,
        "checks": [
          {
            "id": "file-exists",
            "passed": true,
            "actual": 113421
          },
          {
            "id": "dimensions-readable",
            "passed": true,
            "actual": "1920x1080"
          }
        ]
      },
      "semanticChecks": {
        "no-text": "passed",
        "no-watermark": "passed",
        "subject-complete": "passed",
        "style-consistent": "passed",
        "silhouette-fidelity": "passed",
        "negative-space-clean": "passed",
        "background-leak-free": "passed",
        "edge-clean": "passed"
      },
      "reviewer": "host-vision",
      "reviewedAt": "2026-07-21T17:12:19.431Z",
      "note": "完整岸线与芦苇轮廓在原分辨率证据和跨时刻证明中连续，无文字、泄漏或裁切。",
      "evidenceFiles": [
        {
          "file": "dist/last-red-leaf/style-proof/evidence/bank-upper-alpha.png",
          "sha256": "f31c36958af13bcd49337708ec8faf0b7788cf0bfaa48c45f3a2a0561ffe34f8"
        },
        {
          "file": "dist/last-red-leaf/style-proof/evidence/bank-upper-checkerboard.png",
          "sha256": "0078d682422e47d385ff7674ee02014b92ce86c54685ca7ae2daa10392244ba3"
        },
        {
          "file": "dist/last-red-leaf/style-proof/evidence/bank-upper-tight.png",
          "sha256": "0078d682422e47d385ff7674ee02014b92ce86c54685ca7ae2daa10392244ba3"
        },
        {
          "file": "dist/last-red-leaf/style-proof/evidence/bank-upper-motion-stress.jpg",
          "sha256": "f787f52dbbb9505a871bd5bb1adee16510de16f5b1e6ad6c2d2a3ca6b8fb531f"
        }
      ],
      "status": "passed"
    },
    {
      "assetId": "water-lower",
      "file": "public/projects/last-red-leaf/assets/style/water-lower.png",
      "kind": "environment",
      "sources": [
        "scene:scene-01:node:water-lower",
        "scene:scene-02:node:water-lower",
        "manifest:water-lower"
      ],
      "semanticBinding": {
        "riskClass": "topology-critical",
        "contractIds": [
          "shore-water-boundary"
        ]
      },
      "requiredChecks": [
        "no-text",
        "no-watermark",
        "subject-complete",
        "style-consistent",
        "silhouette-fidelity",
        "negative-space-clean",
        "background-leak-free",
        "edge-clean"
      ],
      "semanticContractFingerprints": {
        "shore-water-boundary": "1341676ab665534de5eae6af03493fdbddb26f19afcffb14df1f069c8c2da7e4"
      },
      "sha256": "0078d682422e47d385ff7674ee02014b92ce86c54685ca7ae2daa10392244ba3",
      "fingerprint": "5e27c185590d907fc8edae2a4ed73f96f6724d2192eaa856c7c7fa2e3c611fa5",
      "technical": {
        "passed": true,
        "checks": [
          {
            "id": "file-exists",
            "passed": true,
            "actual": 113421
          },
          {
            "id": "dimensions-readable",
            "passed": true,
            "actual": "1920x1080"
          }
        ]
      },
      "semanticChecks": {
        "no-text": "passed",
        "no-watermark": "passed",
        "subject-complete": "passed",
        "style-consistent": "passed",
        "silhouette-fidelity": "passed",
        "negative-space-clean": "passed",
        "background-leak-free": "passed",
        "edge-clean": "passed"
      },
      "reviewer": "host-vision",
      "reviewedAt": "2026-07-21T17:12:19.431Z",
      "note": "水面分层和暖色光路完整，边缘与岸线注册一致。",
      "evidenceFiles": [
        {
          "file": "dist/last-red-leaf/style-proof/evidence/water-lower-alpha.png",
          "sha256": "f31c36958af13bcd49337708ec8faf0b7788cf0bfaa48c45f3a2a0561ffe34f8"
        },
        {
          "file": "dist/last-red-leaf/style-proof/evidence/water-lower-checkerboard.png",
          "sha256": "0078d682422e47d385ff7674ee02014b92ce86c54685ca7ae2daa10392244ba3"
        },
        {
          "file": "dist/last-red-leaf/style-proof/evidence/water-lower-tight.png",
          "sha256": "0078d682422e47d385ff7674ee02014b92ce86c54685ca7ae2daa10392244ba3"
        },
        {
          "file": "dist/last-red-leaf/style-proof/evidence/water-lower-motion-stress.jpg",
          "sha256": "f787f52dbbb9505a871bd5bb1adee16510de16f5b1e6ad6c2d2a3ca6b8fb531f"
        }
      ],
      "status": "passed"
    },
    {
      "assetId": "scene1-ground-rear",
      "file": "public/projects/last-red-leaf/assets/scene1/scene1-ground-rear.png",
      "kind": "prop",
      "sources": [
        "scene:scene-01:node:scene1-ground-rear",
        "manifest:scene1-ground-rear"
      ],
      "semanticBinding": {
        "riskClass": "decorative",
        "contractIds": []
      },
      "requiredChecks": [
        "no-text",
        "no-watermark",
        "subject-complete",
        "style-consistent",
        "silhouette-fidelity",
        "negative-space-clean",
        "background-leak-free",
        "edge-clean"
      ],
      "semanticContractFingerprints": {},
      "sha256": "d28f4173cf0902022853a2e8ab7607ed2cb949a63d814f35afb32c904b46a643",
      "fingerprint": "15b75b71e3a835e24648d8b7bf9dd567d630f6418d0f5c71d843cf920feb4a06",
      "technical": {
        "passed": true,
        "checks": [
          {
            "id": "file-exists",
            "passed": true,
            "actual": 1029765
          },
          {
            "id": "dimensions-readable",
            "passed": true,
            "actual": "1920x1080"
          },
          {
            "id": "alpha-present",
            "passed": true,
            "actual": true
          },
          {
            "id": "key-edge-clean",
            "passed": true,
            "expected": "<= 0.12",
            "actual": 0
          }
        ]
      },
      "semanticChecks": {